{"instrument_id":"00000000-0000-4000-8000-000000000003","series_id":"S000000003","class_id":"C000000003","ticker":"MULT","name":"Multi asset baseline fund","fund_type":"mutual_fund","asset_class":"multi_asset","strategy_label":"Moderate Allocation","classification_note":"","holdings":{"report_date":"2026-01-31","items":[],"pct_of_nav_total":88.0},"classes":[],"nav":[]}
