{"instrument_id":"00000000-0000-4000-8000-000000000001","series_id":"S000000001","class_id":"C000000001","ticker":"EQTY","name":"Equity baseline fund","fund_type":"etf","asset_class":"equity","strategy_label":"Large Blend","classification_note":"","holdings":{"report_date":"2026-01-31","items":[],"pct_of_nav_total":99.1},"classes":[],"nav":[]}
