{"instrument_id":"00000000-0000-4000-8000-000000000005","series_id":"S000000005","class_id":"C000000005","ticker":"CASH","name":"Cash baseline fund","fund_type":"mmf","asset_class":"cash","strategy_label":"Government Money Market","classification_note":"","holdings":{"report_date":"2026-01-31","items":[],"pct_of_nav_total":99.8},"classes":[],"nav":[]}
