{"instrument_id":"00000000-0000-4000-8000-000000000002","series_id":"S000000002","class_id":"C000000002","ticker":"BOND","name":"Fixed income baseline fund","fund_type":"mutual_fund","asset_class":"fixed_income","strategy_label":"Intermediate Core Bond","classification_note":"","holdings":{"report_date":"2026-01-31","items":[],"pct_of_nav_total":97.0},"classes":[],"nav":[]}
